en,th
besides the location not much going for it especially as there are so many fantastic beaches all around patong and phuket in general.,นอกจากทำเลที่ตั้งไม่ค่อยไปโดยเฉพาะอย่างยิ่งเพราะมีชายหาดที่ยอดเยี่ยมมากมายรอบ ๆ ป่าตองและภูเก็ตโดยทั่วไป
"not a nice beach, over crowded and dirty. would definitely avoid if possible. but if that did not bother you than give it a go.",ไม่ใช่ชายหาดที่สวยงามแออัดและสกปรก จะหลีกเลี่ยงอย่างแน่นอนถ้าเป็นไปได้ แต่ถ้านั่นไม่ได้รบกวนคุณมากกว่าปล่อยมันไป
"patong beach is one of the worst beaches i have been to in thailand, as it is overcrowded with tourists and dirty. there were no nice food stands to order from, so it can not even touch beaches in hua hin, pattaya and koh chang to name a few. katong beach which is the nearest.",หาดป่าตองเป็นหนึ่งในชายหาดที่เลวร้ายที่สุดที่ฉันเคยไปมาในประเทศไทยเพราะมีนักท่องเที่ยวหนาแน่นและสกปรก ไม่มีอาหารที่ดีที่จะสั่งจากดังนั้นมันจึงไม่สามารถสัมผัสชายหาดในหัวหินพัทยาและเกาะช้างเพื่อชื่อไม่กี่ หาดกะตงซึ่งเป็นหาดที่ใกล้ที่สุด
"usa resident and international traveler here i was not at all impressed with patong. save yourself a trip and go to the mexican riviera maya instead. the beach was dirty, the streets stink, and the hustlers on and around the beach are overwhelming. everyone said this place.",ที่อาศัยอยู่ในสหรัฐอเมริกาและนักท่องเที่ยวต่างชาติที่นี่ฉันไม่ประทับใจเลยกับป่าตอง บันทึกการเดินทางของคุณและไปที่มายาริเวียร่ามายาแทน ชายหาดสกปรกถนนมีกลิ่นเหม็นและนักธุรกิจที่เดินทอดน่องไปรอบ ๆ ทุกคนพูดที่นี่
dirty looking water beach attractions that seemed a total rip off mainly parachute crack. after watching i timed the air time and a disgusting one minute twenty seconds for something like two thousand baht,สถานที่ท่องเที่ยวทางน้ำสกปรกมองชายหาดที่ดูเหมือนจะฉีกออกทั้งหมดส่วนใหญ่แตกร่มชูชีพ หลังจากดูฉันหมดเวลาออกอากาศและน่าขยะแขยงหนึ่งนาทียี่สิบวินาทีสำหรับบางอย่างเช่นสองพันบาท
"this beach probably is the worst in phuket. too many people, garbage left everywhere, very little swimming area, dirty water because most of it is taken by the watercraft and boats. noisy because too close to the main road. do not expect to lay down in paradise is not",ชายหาดนี้น่าจะเลวร้ายที่สุดในภูเก็ต มีคนจำนวนมากขยะทิ้งไปทุกที่บริเวณสระว่ายน้ำน้อยมากน้ำสกปรกเพราะส่วนใหญ่เป็นเรือและเรือ เสียงดังเพราะใกล้ถนนใหญ่เกินไป อย่าคาดหวังว่าจะนอนลงบนสวรรค์ไม่ได้
"my husband, our ten years old son and i went to patong beach. my son like the beach so much. as you walk pass by, there will be locals promoting jetski & parachuting. they a bit quite pushy, we politely reject them as we are not interested, they keep mumbling non- stop. they are very rude & not friendly. phuket is not a friendly spot. if can, try to avoid this place. otherwise your holidays going to be spoiled by their sh*t attitude",สามีของฉันลูกชายอายุสิบขวบของฉันและฉันไปที่หาดป่าตอง ลูกชายของฉันชอบชายหาดมาก ขณะที่คุณเดินผ่านจะมีชาวบ้านที่ส่งเสริม jetski และกระโดดร่ม พวกเขาค่อนข้างเร่งเร้าเราปฏิเสธพวกเขาอย่างสุภาพในขณะที่เราไม่สนใจพวกเขาพูดพึมพำไม่หยุดยั้ง พวกเขาหยาบคายมากและไม่เป็นมิตร ภูเก็ตไม่ใช่สถานที่ที่เป็นมิตร ถ้าทำได้ให้พยายามหลีกเลี่ยงสถานที่นี้ มิฉะนั้นวันหยุดของคุณจะถูกทำลายโดยทัศนคติ sh * t ของพวกเขา
"this is not my kind of place at all. too many bodies, chairs, beds, umbrellas all on top of each other. there is no personal space. it probably is not, but it feels dirty. hated it.","นี่ไม่ใช่สถานที่ของฉันเลย ร่างกาย, เก้าอี้, เตียง, ร่มมากเกินไป ไม่มีพื้นที่ส่วนตัว มันอาจจะไม่ใช่ แต่รู้สึกสกปรก เกลียดมัน"
